{
 "page": 1,
 "profile": "FAST",
 "quality": {
  "blur": 0.0,
  "contrast": 0.0,
  "noise": 0.0,
  "skew_deg": 0.0
 },
 "lines": [
  {
   "id": "L1",
   "seq": 1,
   "body": "தகவிசொல்லியது,",
   "bbox": [
    373,
    0,
    495,
    42
   ],
   "confidence": 0.99
  },
  {
   "id": "L2",
   "seq": 2,
   "body": "எ - து, தலைவன் பிரியக்கருதிய தறிந்த தோழி தலைவியிடங் கூற",
   "bbox": [
    120,
    42,
    747,
    40
   ],
   "confidence": 0.99
  },
  {
   "id": "L3",
   "seq": 3,
   "body": "லும், தலைவி அவரை யின்றியமையாத என்னை வருந்தும்படி விட்டுப் பிரி",
   "bbox": [
    120,
    82,
    747,
    40
   ],
   "confidence": 0.9
  },
  {
   "id": "L4",
   "seq": 4,
   "body": "கின்ற அன்னதொரு குணக்குறைபாடிலரெனத் தலைவனைப் புகழ்ந்து",
   "bbox": [
    120,
    121,
    747,
    40
   ],
   "confidence": 0.99
  },
  {
   "id": "L5",
   "seq": 5,
   "body": "கூறாநிற்பது.",
   "bbox": [
    120,
    160,
    747,
    40
   ],
   "confidence": 0.99
  },
  {
   "id": "L6",
   "seq": 6,
   "body": "கபிலர்பாடியது.",
   "bbox": [
    369,
    196,
    242,
    42
   ],
   "confidence": 0.99
  },
  {
   "id": "L7",
   "seq": 7,
   "body": "நின்ற சொல்லர் நீடுதோன் றினிய",
   "bbox": [
    242,
    237,
    425,
    40
   ],
   "confidence": 0.99
  },
  {
   "id": "L8",
   "seq": 8,
   "body": "ரென்று மென்றோள் பிரிபறி யலரே",
   "bbox": [
    242,
    277,
    425,
    40
   ],
   "confidence": 0.76
  },
  {
   "id": "L9",
   "seq": 9,
   "body": "தாமரைத் தண்டா தூதி மீமிசைச்",
   "bbox": [
    242,
    317,
    425,
    40
   ],
   "confidence": 0.99
  },
  {
   "id": "L10",
   "seq": 10,
   "body": "சாந்திற் றொடுத்த தீந்தேன் போலப்",
   "bbox": [
    242,
    356,
    425,
    40
   ],
   "confidence": 0.99
  },
  {
   "id": "L11",
   "seq": 11,
   "body": "புரைய மன்ற புரையோர் கேண்மை",
   "bbox": [
    242,
    396,
    425,
    40
   ],
   "confidence": 0.99
  },
  {
   "id": "L12",
   "seq": 12,
   "body": "நீரின் றமையா வுலகம் போலத்",
   "bbox": [
    242,
    436,
    425,
    40
   ],
   "confidence": 0.99
  },
  {
   "id": "L13",
   "seq": 13,
   "body": "தம்மின் றமையா நந்நயந் தருளி",
   "bbox": [
    242,
    476,
    425,
    40
   ],
   "confidence": 0.62
  },
  {
   "id": "L14",
   "seq": 14,
   "body": "நறுநுதல் பசத்த லஞ்சிச்",
   "bbox": [
    242,
    515,
    425,
    40
   ],
   "confidence": 0.99
  },
  {
   "id": "L15",
   "seq": 15,
   "body": "சிறுமை யுறுபவோ செய்பறி யலரே.",
   "bbox": [
    242,
    555,
    425,
    40
   ],
   "confidence": 0.99
  },
  {
   "id": "L16",
   "seq": 16,
   "body": "உரை:- தோழி, நம் காதலர் நிலைமை தவறாத வாய்மையுடையவர்;",
   "bbox": [
    127,
    618,
    748,
    36
   ],
   "confidence": 0.99
  },
  {
   "id": "L17",
   "seq": 17,
   "body": "நெடிதாகத் தோன்றுகின்ற இனிமையுடையவர்; எப்பொழுதும் என்தோள்",
   "bbox": [
    127,
    654,
    748,
    36
   ],
   "confidence": 0.99
  },
  {
   "id": "L18",
   "seq": 18,
   "body": "களைப் பிரியும் அன்னதொரு குணக்குறைபாடிலர்; அத்தகைய மேதக்கோ",
   "bbox": [
    127,
    690,
    748,
    36
   ],
   "confidence": 0.99
  },
  {
   "id": "L19",
   "seq": 19,
   "body": "ருடைய நட்பு, தாமரையின் தண்ணிய தாதினையும் மேலோங்கிய சந்தனத்",
   "bbox": [
    127,
    726,
    748,
    36
   ],
   "confidence": 0.99
  },
  {
   "id": "L20",
   "seq": 20,
   "body": "திண் தாதினையும் ஊதி அந்தச் சந்தனமரத்தில் வைத்த இனிய தேன்போ",
   "bbox": [
    127,
    762,
    748,
    36
   ],
   "confidence": 0.9
  },
  {
   "id": "L21",
   "seq": 21,
   "body": "லத் திண்ணமாக மேதக்கன, ஆதலின் அவர் நீரையின்றி யமையாத உலகி",
   "bbox": [
    127,
    797,
    748,
    36
   ],
   "confidence": 0.99
  },
  {
   "id": "L22",
   "seq": 22,
   "body": "யல்போலத் தம்மையின்றி யமையாத நம்பால் முன்பு விருப்பமிகவைத்தரு",
   "bbox": [
    127,
    833,
    748,
    36
   ],
   "confidence": 0.99
  },
  {
   "id": "L23",
   "seq": 23,
   "body": "ளிப் பின்பு பிரிதலால் நம் நறிய துதல் பசலையூர்தற்கு அஞ்சிச் செய்வதறி",
   "bbox": [
    127,
    869,
    748,
    36
   ],
   "confidence": 0.99
  },
  {
   "id": "L24",
   "seq": 24,
   "body": "யாராய்த் தடுமாற்றமடைவாரோ? அங்ஙனஞ்செய்யார்காண்; எ - று.",
   "bbox": [
    127,
    905,
    748,
    36
   ],
   "confidence": 0.99
  },
  {
   "id": "L25",
   "seq": 25,
   "body": "நின்றசொல்லோடு எனவும் பாடம்.",
   "bbox": [
    189,
    942,
    353,
    36
   ],
   "confidence": 0.99
  },
  {
   "id": "L26",
   "seq": 26,
   "body": "சாந்து - சந்தனமரம். புரை - உயர்ச்சி. சிறுமை - நோயுமாம்.",
   "bbox": [
    189,
    977,
    593,
    36
   ],
   "confidence": 0.99
  },
  {
   "id": "L27",
   "seq": 27,
   "body": "தாமரைத்தாது தலைவனுள்ளத்திற்கும் சந்தனத்தாது தலைவியுள்ளத்",
   "bbox": [
    136,
    1013,
    741,
    36
   ],
   "confidence": 0.99
  },
  {
   "id": "L28",
   "seq": 28,
   "body": "திற்கும் உவமையாக்கி இருவருட்கருத்தும் ஒத்த வழி சாந்திலே தீந்தேனி",
   "bbox": [
    136,
    1049,
    741,
    36
   ],
   "confidence": 0.99
  },
  {
   "id": "L29",
   "seq": 29,
   "body": "றால் வைத்ததுபோலத் தலைவன் தலைவிபால் அன்புவைத்தானெனப் பொ",
   "bbox": [
    136,
    1085,
    741,
    36
   ],
   "confidence": 0.99
  },
  {
   "id": "L30",
   "seq": 30,
   "body": "ருந்தவுரைக்க. இடையிலே பலவாயசொற்களைப் பொருந்தப் பெய்துரைப்",
   "bbox": [
    136,
    1121,
    741,
    36
   ],
   "confidence": 0.54
  },
  {
   "id": "L31",
   "seq": 31,
   "body": "பனவெல்லாம் இசையெச்சமெனக் கொள்க",
   "bbox": [
    136,
    1157,
    741,
    36
   ],
   "confidence": 0.99
  },
  {
   "id": "L32",
   "seq": 32,
   "body": "ச தற்கிளை நா னூறு மூலமும் உரையும்.",
   "bbox": [
    126,
    1199,
    640,
    49
   ],
   "confidence": 0.99
  },
  {
   "id": "L33",
   "seq": 33,
   "body": "இயற்கைப்புணர்ச்சியிறுதியின்கண் நின்னிற்பிரியேனென்றதனை இன்",
   "bbox": [
    166,
    1271,
    704,
    49
   ],
   "confidence": 0.99
  }
 ],
 "text": "தகவிசொல்லியது,\nஎ - து, தலைவன் பிரியக்கருதிய தறிந்த தோழி தலைவியிடங் கூற\nலும், தலைவி அவரை யின்றியமையாத என்னை வருந்தும்படி விட்டுப் பிரி\nகின்ற அன்னதொரு குணக்குறைபாடிலரெனத் தலைவனைப் புகழ்ந்து\nகூறாநிற்பது.\nகபிலர்பாடியது.\nநின்ற சொல்லர் நீடுதோன் றினிய\nரென்று மென்றோள் பிரிபறி யலரே\nதாமரைத் தண்டா தூதி மீமிசைச்\nசாந்திற் றொடுத்த தீந்தேன் போலப்\nபுரைய மன்ற புரையோர் கேண்மை\nநீரின் றமையா வுலகம் போலத்\nதம்மின் றமையா நந்நயந் தருளி\nநறுநுதல் பசத்த லஞ்சிச்\nசிறுமை யுறுபவோ செய்பறி யலரே.\nஉரை:- தோழி, நம் காதலர் நிலைமை தவறாத வாய்மையுடையவர்;\nநெடிதாகத் தோன்றுகின்ற இனிமையுடையவர்; எப்பொழுதும் என்தோள்\nகளைப் பிரியும் அன்னதொரு குணக்குறைபாடிலர்; அத்தகைய மேதக்கோ\nருடைய நட்பு, தாமரையின் தண்ணிய தாதினையும் மேலோங்கிய சந்தனத்\nதிண் தாதினையும் ஊதி அந்தச் சந்தனமரத்தில் வைத்த இனிய தேன்போ\nலத் திண்ணமாக மேதக்கன, ஆதலின் அவர் நீரையின்றி யமையாத உலகி\nயல்போலத் தம்மையின்றி யமையாத நம்பால் முன்பு விருப்பமிகவைத்தரு\nளிப் பின்பு பிரிதலால் நம் நறிய துதல் பசலையூர்தற்கு அஞ்சிச் செய்வதறி\nயாராய்த் தடுமாற்றமடைவாரோ? அங்ஙனஞ்செய்யார்காண்; எ - று.\nநின்றசொல்லோடு எனவும் பாடம்.\nசாந்து - சந்தனமரம். புரை - உயர்ச்சி. சிறுமை - நோயுமாம்.\nதாமரைத்தாது தலைவனுள்ளத்திற்கும் சந்தனத்தாது தலைவியுள்ளத்\nதிற்கும் உவமையாக்கி இருவருட்கருத்தும் ஒத்த வழி சாந்திலே தீந்தேனி\nறால் வைத்ததுபோலத் தலைவன் தலைவிபால் அன்புவைத்தானெனப் பொ\nருந்தவுரைக்க. இடையிலே பலவாயசொற்களைப் பொருந்தப் பெய்துரைப்\nபனவெல்லாம் இசையெச்சமெனக் கொள்க\nச தற்கிளை நா னூறு மூலமும் உரையும்.\nஇயற்கைப்புணர்ச்சியிறுதியின்கண் நின்னிற்பிரியேனென்றதனை இன்",
 "needs_review": false,
 "suggestions": [
  {
   "line": "L3",
   "word": 1,
   "before": "லும்,",
   "candidates": [
    {
     "text": "லும்",
     "score": 0.9,
     "source": "mock"
    }
   ]
  },
  {
   "line": "L3",
   "word": 2,
   "before": "தலைவி",
   "candidates": [
    {
     "text": "தலைவ",
     "score": 0.9,
     "source": "mock"
    }
   ]
  },
  {
   "line": "L8",
   "word": 1,
   "before": "ரென்று",
   "candidates": [
    {
     "text": "ரென்ற",
     "score": 0.9,
     "source": "mock"
    }
   ]
  },
  {
   "line": "L8",
   "word": 2,
   "before": "மென்றோள்",
   "candidates": [
    {
     "text": "மென்றோள",
     "score": 0.9,
     "source": "mock"
    }
   ]
  },
  {
   "line": "L13",
   "word": 1,
   "before": "தம்மின்",
   "candidates": [
    {
     "text": "தம்மின",
     "score": 0.9,
     "source": "mock"
    }
   ]
  },
  {
   "line": "L13",
   "word": 2,
   "before": "றமையா",
   "candidates": [
    {
     "text": "றமைய",
     "score": 0.9,
     "source": "mock"
    }
   ]
  },
  {
   "line": "L20",
   "word": 1,
   "before": "திண்",
   "candidates": [
    {
     "text": "திண",
     "score": 0.9,
     "source": "mock"
    }
   ]
  },
  {
   "line": "L20",
   "word": 2,
   "before": "தாதினையும்",
   "candidates": [
    {
     "text": "தாதினையும",
     "score": 0.9,
     "source": "mock"
    }
   ]
  },
  {
   "line": "L30",
   "word": 1,
   "before": "ருந்தவுரைக்க.",
   "candidates": [
    {
     "text": "ருந்தவுரைக்க",
     "score": 0.9,
     "source": "mock"
    }
   ]
  },
  {
   "line": "L30",
   "word": 2,
   "before": "இடையிலே",
   "candidates": [
    {
     "text": "இடையில",
     "score": 0.9,
     "source": "mock"
    }
   ]
  }
 ]
}
